{
  "title": "샘플 관리 콘솔 — 테스트케이스 리포트",
  "id_prefix": "SMP",
  "summary_label": "종합",
  "auto_nav": true,
  "menus": [
    {
      "name": "회원 관리",
      "code": "USR",
      "groups": [
        {
          "name": "계정",
          "code": "ACC",
          "screens": [
            {
              "name": "회원 목록",
              "code": "LIST",
              "cases": [
                {
                  "section": "목록",
                  "func": "화면 진입/렌더링",
                  "precondition": "관리자로 로그인되어 있다.",
                  "process": "1. 회원 목록이 표로 표시되는지 확인한다.\n2. 컬럼 헤더(ID·이름·이메일·가입일·상태)를 확인한다.",
                  "expected": "회원 목록이 표 형태로 렌더링되고 지정된 컬럼이 순서대로 표시된다."
                },
                {
                  "section": "목록",
                  "func": "이메일로 검색",
                  "precondition": "회원이 1건 이상 존재한다.",
                  "process": "1. 검색창에 존재하는 이메일 일부를 입력한다.\n2. [검색] 버튼을 클릭한다.",
                  "expected": "입력한 문자열을 포함하는 회원만 목록에 표시된다."
                },
                {
                  "section": "목록",
                  "func": "검색 결과 0건",
                  "precondition": "회원이 1건 이상 존재한다.",
                  "process": "1. 검색창에 존재하지 않는 값(예: zzz-none)을 입력한다.\n2. [검색] 버튼을 클릭한다.",
                  "expected": "'검색 결과가 없습니다' 빈 메시지가 표시된다."
                }
              ]
            },
            {
              "name": "회원 등록",
              "code": "ADD",
              "cases": [
                {
                  "section": "등록",
                  "func": "필수값 미입력 검증",
                  "precondition": "회원 등록 화면이 열려 있다.",
                  "process": "1. 이름을 비운 채로 [저장] 버튼을 클릭한다.",
                  "expected": "'이름을 입력하세요' 검증 메시지가 표시되고 저장되지 않는다."
                },
                {
                  "section": "등록",
                  "func": "이메일 형식 검증",
                  "precondition": "회원 등록 화면이 열려 있다.",
                  "process": "1. 이메일에 'abc'(형식 오류)를 입력한다.\n2. [저장] 버튼을 클릭한다.",
                  "expected": "'올바른 이메일 형식이 아닙니다' 메시지가 표시된다."
                },
                {
                  "section": "등록",
                  "func": "정상 등록",
                  "precondition": "회원 등록 화면이 열려 있다.",
                  "process": "1. 이름·이메일을 올바르게 입력한다.\n2. [저장] 버튼을 클릭한다.",
                  "expected": "'저장되었습니다' 메시지가 표시되고 목록에 새 회원이 추가된다."
                }
              ]
            },
            {
              "name": "회원 삭제",
              "code": "DEL",
              "cases": [
                {
                  "section": "삭제",
                  "func": "삭제 확인창 취소",
                  "precondition": "삭제 가능한 회원이 존재한다.",
                  "process": "1. 회원 행의 [삭제] 버튼을 클릭한다.\n2. 확인창에서 [취소]를 클릭한다.",
                  "expected": "회원이 삭제되지 않고 목록에 그대로 남는다."
                },
                {
                  "section": "삭제",
                  "func": "정상 삭제",
                  "precondition": "삭제 가능한 회원이 존재한다.",
                  "process": "1. 회원 행의 [삭제] 버튼을 클릭한다.\n2. 확인창에서 [확인]을 클릭한다.",
                  "expected": "'삭제되었습니다' 메시지가 표시되고 목록에서 사라진다."
                }
              ]
            }
          ]
        }
      ]
    },
    {
      "name": "대시보드",
      "code": "DSH",
      "groups": [
        {
          "name": "대시보드",
          "code": "",
          "screens": [
            {
              "name": "요약 대시보드",
              "code": "SUM",
              "cases": [
                {
                  "section": "조회",
                  "func": "카드 지표 렌더링",
                  "precondition": "데이터가 존재한다.",
                  "process": "1. 대시보드 상단 카드(총 회원·활성·신규)를 확인한다.",
                  "expected": "각 카드에 숫자 지표가 표시된다.",
                  "note": "차트 시각 확인 Partial"
                },
                {
                  "section": "조회",
                  "func": "기간 필터 변경",
                  "precondition": "데이터가 존재한다.",
                  "process": "1. 기간 필터를 '최근 7일'에서 '최근 30일'로 변경한다.",
                  "expected": "선택한 기간에 맞게 지표와 차트가 갱신된다.",
                  "note": "차트 시각 확인 Partial"
                }
              ]
            }
          ]
        }
      ]
    }
  ]
}
